training/results/result.csv

Distribution,In-Distribution,In-Distribution,In-Distribution,In-Distribution,In-Distribution,In-Distribution,In-Distribution,In-Distribution,In-Distribution,In-Distribution,In-Distribution,In-Distribution,In-Distribution,In-Distribution,In-Distribution,In-Distribution,In-Distribution,In-Distribution,In-Distribution,In-Distribution,In-Distribution,In-Distribution,In-Distribution,In-Distribution,In-Distribution,In-Distribution,In-Distribution,In-Distribution,In-Distribution,In-Distribution,In-Distribution,In-Distribution,In-Distribution,In-Distribution,In-Distribution,In-Distribution,In-Distribution,In-Distribution,In-Distribution,In-Distribution,In-Distribution,In-Distribution,In-Distribution,In-Distribution,In-Distribution,In-Distribution,In-Distribution,In-Distribution,In-Distribution,Out-of-Distribution,Out-of-Distribution,Out-of-Distribution,Out-of-Distribution,Out-of-Distribution,Out-of-Distribution,Out-of-Distribution,Out-of-Distribution,Out-of-Distribution,Out-of-Distribution,Out-of-Distribution,Out-of-Distribution,Out-of-Distribution,Out-of-Distribution,Out-of-Distribution,Out-of-Distribution,Out-of-Distribution,Out-of-Distribution,Out-of-Distribution,Out-of-Distribution,Out-of-Distribution,Out-of-Distribution,Out-of-Distribution,Out-of-Distribution,Out-of-Distribution,Out-of-Distribution,Out-of-Distribution,Out-of-Distribution,Out-of-Distribution,Out-of-Distribution,Out-of-Distribution,Out-of-Distribution,Out-of-Distribution,Out-of-Distribution,Out-of-Distribution,Out-of-Distribution,Out-of-Distribution,Out-of-Distribution,Out-of-Distribution,Out-of-Distribution,Out-of-Distribution,Out-of-Distribution,Out-of-Distribution,Out-of-Distribution,Out-of-Distribution,Out-of-Distribution,Out-of-Distribution,Out-of-Distribution,Out-of-Distribution
Category,Baseline,Classification Report,Classification Report,Classification Report,Classification Report,Classification Report,Classification Report,Classification Report,Classification Report,Classification Report,Classification Report,Classification Report,Classification Report,Classification Report,Classification Report,Classification Report,Classification Report,Classification Report,Classification Report,Classification Report,Classification Report,Classification Report,Classification Report,Classification Report,Classification Report,Classification Report,Classification Report,Classification Report,Classification Report,Classification Report,Classification Report,Classification Report,Classification Report,Classification Report,Classification Report,Classification Report,Classification Report,Classification Report,Classification Report,Classification Report,Classification Report,Classification Report,Dropout,Consistency,Consistency,Dropout,Dropout,Dropout,Dropout,Baseline,Classification Report,Classification Report,Classification Report,Classification Report,Classification Report,Classification Report,Classification Report,Classification Report,Classification Report,Classification Report,Classification Report,Classification Report,Classification Report,Classification Report,Classification Report,Classification Report,Classification Report,Classification Report,Classification Report,Classification Report,Classification Report,Classification Report,Classification Report,Classification Report,Classification Report,Classification Report,Classification Report,Classification Report,Classification Report,Classification Report,Classification Report,Classification Report,Classification Report,Classification Report,Classification Report,Classification Report,Classification Report,Classification Report,Classification Report,Classification Report,Classification Report,Dropout,Consistency,Consistency,Dropout,Dropout,Dropout,Dropout
Sub-Category,Overall,B cell,B cell,B cell,B cell,CD14+ monocyte,CD14+ monocyte,CD14+ monocyte,CD14+ monocyte,CD4+ T cell,CD4+ T cell,CD4+ T cell,CD4+ T cell,Cytotoxic T cell,Cytotoxic T cell,Cytotoxic T cell,Cytotoxic T cell,Dendritic cell,Dendritic cell,Dendritic cell,Dendritic cell,Megakaryocyte,Megakaryocyte,Megakaryocyte,Megakaryocyte,Natural killer cell,Natural killer cell,Natural killer cell,Natural killer cell,Plasma cell,Plasma cell,Plasma cell,Plasma cell,Total_Accuracy,macro avg,macro avg,macro avg,macro avg,weighted avg,weighted avg,weighted avg,weighted avg,Random,Num Samples,Inconsistent Predictions,FI_0.1%,FI_0.5%,FI_1.0%,FI_2.0%,Overall,B cell,B cell,B cell,B cell,CD14+ monocyte,CD14+ monocyte,CD14+ monocyte,CD14+ monocyte,CD4+ T cell,CD4+ T cell,CD4+ T cell,CD4+ T cell,Cytotoxic T cell,Cytotoxic T cell,Cytotoxic T cell,Cytotoxic T cell,Dendritic cell,Dendritic cell,Dendritic cell,Dendritic cell,Megakaryocyte,Megakaryocyte,Megakaryocyte,Megakaryocyte,Natural killer cell,Natural killer cell,Natural killer cell,Natural killer cell,Plasma cell,Plasma cell,Plasma cell,Plasma cell,Total_Accuracy,macro avg,macro avg,macro avg,macro avg,weighted avg,weighted avg,weighted avg,weighted avg,Random,Num Samples,Inconsistent Predictions,FI_0.1%,FI_0.5%,FI_1.0%,FI_2.0%
Metric,Accuracy,precision,recall,f1-score,support,precision,recall,f1-score,support,precision,recall,f1-score,support,precision,recall,f1-score,support,precision,recall,f1-score,support,precision,recall,f1-score,support,precision,recall,f1-score,support,precision,recall,f1-score,support,accuracy,precision,recall,f1-score,support,precision,recall,f1-score,support,score,Count,Count,Accuracy,Accuracy,Accuracy,Accuracy,Accuracy,precision,recall,f1-score,support,precision,recall,f1-score,support,precision,recall,f1-score,support,precision,recall,f1-score,support,precision,recall,f1-score,support,precision,recall,f1-score,support,precision,recall,f1-score,support,precision,recall,f1-score,support,accuracy,precision,recall,f1-score,support,precision,recall,f1-score,support,score,Count,Count,Accuracy,Accuracy,Accuracy,Accuracy
0,0.9213446826850555,1.0,0.9916666666666667,0.99581589958159,120.0,0.9953596287703016,0.9996116504854369,0.9974811083123426,2575.0,0.8691484618814088,0.9971867007672635,0.9287756074321105,3910.0,0.9802235597592434,0.625,0.763307666555072,1824.0,1.0,0.6,0.75,5.0,1.0,1.0,1.0,7.0,0.8757192174913694,0.9620733249051833,0.9168674698795181,791.0,1.0,0.9795918367346939,0.9896907216494846,49.0,0.9213446826850555,0.9650563584877905,0.8943912724449055,0.9177423091762648,9281.0,0.9291071225165788,0.9213446826850555,0.9154492602893652,9281.0,0.9119491434112703,9281,0,0.919189742484646,0.8443055705204181,0.7861221851093633,0.7326796681392092,0.8764576002207962,0.999242615501136,0.9997474109623642,0.9994949494949495,3959.0,0.9065393518518519,0.9993620414673047,0.9506903353057199,3135.0,0.9478004630604083,0.9886563231850117,0.9677973994340366,13664.0,0.6200519639309185,0.8383963628848936,0.7128799859427166,4839.0,0.987987987987988,0.6219281663516069,0.7633410672853829,529.0,1.0,0.5930232558139535,0.7445255474452555,86.0,0.9426229508196722,0.12540894220283533,0.22136669874879691,2751.0,1.0,1.0,1.0,23.0,0.8764576002207962,0.9255306666439969,0.7708153128584962,0.7950119979571073,28986.0,0.8960871022871129,0.8764576002207962,0.8525095230114406,28986.0,0.8761781549713655,28986,0,0.8763541019802663,0.8496515559235494,0.817463603118747,0.733733526530049
0,0.886757892468484,1.0,0.9916666666666667,0.99581589958159,120.0,0.9984490112446684,1.0,0.9992239037640668,2575.0,0.9385690195133702,0.9964194373401535,0.9666294504403921,3910.0,0.9975186104218362,0.4407894736842105,0.6114068441064638,1824.0,1.0,0.2,0.3333333333333333,5.0,1.0,1.0,1.0,7.0,0.4987309644670051,0.9936788874841972,0.6641318124207858,791.0,1.0,0.8571428571428571,0.9230769230769231,49.0,0.886757892468484,0.92915845070586,0.8099621652897606,0.8117022708404444,9281.0,0.9304796044127926,0.886757892468484,0.8799108279858489,9281.0,0.8676435728908523,9281,0,0.8429048593901519,0.8199547462557915,0.7916172826204073,0.7101605430449305,0.9067825846960602,0.998989898989899,0.9992422328870927,0.999116050006314,3959.0,0.868421052631579,1.0,0.9295774647887324,3135.0,0.920654230873209,0.9969262295081968,0.9572733661278988,13664.0,0.8147353361945636,0.7061376317420954,0.7565592826303553,4839.0,0.989247311827957,0.17391304347826086,0.2958199356913183,529.0,1.0,0.5697674418604651,0.725925925925926,86.0,0.8802474591250552,0.7241003271537623,0.7945751894694855,2751.0,1.0,0.9130434782608695,0.9545454545454546,23.0,0.9067825846960602,0.9340369112052829,0.7603912981113429,0.8016740836481857,28986.0,0.905737159339269,0.9067825846960602,0.8982836094943423,28986.0,0.8947871386186433,28986,0,0.8986407231077072,0.8551714620851446,0.6922652314910647,0.5764162009245842
mean,0.9040512875767698,1.0,0.9916666666666667,0.99581589958159,120.0,0.996904320007485,0.9998058252427184,0.9983525060382047,2575.0,0.9038587406973895,0.9968030690537084,0.9477025289362513,3910.0,0.9888710850905398,0.5328947368421053,0.6873572553307679,1824.0,1.0,0.4,0.5416666666666666,5.0,1.0,1.0,1.0,7.0,0.6872250909791873,0.9778761061946902,0.7904996411501519,791.0,1.0,0.9183673469387754,0.9563838223632039,49.0,0.9040512875767698,0.9471074045968253,0.852176718867333,0.8647222900083547,9281.0,0.9297933634646858,0.9040512875767698,0.897680044137607,9281.0,0.8897963581510613,9281.0,0.0,0.8810473009373989,0.8321301583881048,0.7888697338648853,0.7214201055920698,0.8916200924584282,0.9991162572455174,0.9994948219247284,0.9993054997506318,3959.0,0.8874802022417154,0.9996810207336524,0.9401339000472262,3135.0,0.9342273469668086,0.9927912763466042,0.9625353827809677,13664.0,0.7173936500627411,0.7722669973134946,0.734719634286536,4839.0,0.9886176499079725,0.39792060491493386,0.5295805014883506,529.0,1.0,0.5813953488372093,0.7352257366855908,86.0,0.9114352049723637,0.42475463467829877,0.5079709441091412,2751.0,1.0,0.9565217391304348,0.9772727272727273,23.0,0.8916200924584282,0.9297837889246399,0.7656033054849196,0.7983430408026465,28986.0,0.9009121308131909,0.8916200924584282,0.8753965662528914,28986.0,0.8854826467950044,28986.0,0.0,0.8874974125439867,0.8524115090043469,0.7548644173049058,0.6550748637273166
std,0.024456553901614258,0.0,0.0,0.0,0.0,0.002184523297303677,0.00027460457521808916,0.001232342482135238,0.0,0.04908774705531146,0.0005425371722658947,0.026766709085126857,0.0,0.012229447604484295,0.13025651232383773,0.10741010162122457,0.0,0.0,0.282842712474619,0.2946278254943948,0.0,0.0,0.0,0.0,0.0,0.26657095014119797,0.022348507622836532,0.17871109723671003,0.0,0.0,0.08658450381876094,0.047103068691252956,0.0,0.024456553901614258,0.025383654023012372,0.05970039419892858,0.07498163018454002,0.0,0.0009704912558685931,0.024456553901614258,0.025129466474555495,0.0,0.0313287693593264,0.0,0.0,0.0539415581381398,0.017218632964999425,0.0038856207133405635,0.0159234260605526,0.021443002161835947,0.00017869755881351652,0.0003572148427312502,0.0002679223978023229,0.0,0.026953707865952838,0.00045110480458468503,0.0149290539128754,0.0,0.01919528486323319,0.005847706840901641,0.007441615316203138,0.0,0.13766193271188845,0.09352104566220101,0.03088592688528843,0.0,0.0008904764269519357,0.3167945314578673,0.3305873624981713,0.0,0.0,0.01644434374852439,0.013151918503821112,0.0,0.04410613315710884,0.4233387381367662,0.4053196108223051,0.0,0.0,0.06148754619013461,0.03214121732666122,0.0,0.021443002161835947,0.006014823211716529,0.007370891514900726,0.004710805969007404,0.0,0.006823620780416684,0.021443002161835947,0.03236716695467928,0.0,0.013158538527979711,0.0,0.0,0.0157590209289488,0.003903163078377412,0.08852861757144762,0.1112401477337562
mean +- std,0.9041 +- 0.0245,1.0 +- 0.0,0.9917 +- 0.0,0.9958 +- 0.0,120.0 +- 0.0,0.9969 +- 0.0022,0.9998 +- 0.0003,0.9984 +- 0.0012,2575.0 +- 0.0,0.9039 +- 0.0491,0.9968 +- 0.0005,0.9477 +- 0.0268,3910.0 +- 0.0,0.9889 +- 0.0122,0.5329 +- 0.1303,0.6874 +- 0.1074,1824.0 +- 0.0,1.0 +- 0.0,0.4 +- 0.2828,0.5417 +- 0.2946,5.0 +- 0.0,1.0 +- 0.0,1.0 +- 0.0,1.0 +- 0.0,7.0 +- 0.0,0.6872 +- 0.2666,0.9779 +- 0.0223,0.7905 +- 0.1787,791.0 +- 0.0,1.0 +- 0.0,0.9184 +- 0.0866,0.9564 +- 0.0471,49.0 +- 0.0,0.9041 +- 0.0245,0.9471 +- 0.0254,0.8522 +- 0.0597,0.8647 +- 0.075,9281.0 +- 0.0,0.9298 +- 0.001,0.9041 +- 0.0245,0.8977 +- 0.0251,9281.0 +- 0.0,0.8898 +- 0.0313,9281.0 +- 0.0,0.0 +- 0.0,0.881 +- 0.0539,0.8321 +- 0.0172,0.7889 +- 0.0039,0.7214 +- 0.0159,0.8916 +- 0.0214,0.9991 +- 0.0002,0.9995 +- 0.0004,0.9993 +- 0.0003,3959.0 +- 0.0,0.8875 +- 0.027,0.9997 +- 0.0005,0.9401 +- 0.0149,3135.0 +- 0.0,0.9342 +- 0.0192,0.9928 +- 0.0058,0.9625 +- 0.0074,13664.0 +- 0.0,0.7174 +- 0.1377,0.7723 +- 0.0935,0.7347 +- 0.0309,4839.0 +- 0.0,0.9886 +- 0.0009,0.3979 +- 0.3168,0.5296 +- 0.3306,529.0 +- 0.0,1.0 +- 0.0,0.5814 +- 0.0164,0.7352 +- 0.0132,86.0 +- 0.0,0.9114 +- 0.0441,0.4248 +- 0.4233,0.508 +- 0.4053,2751.0 +- 0.0,1.0 +- 0.0,0.9565 +- 0.0615,0.9773 +- 0.0321,23.0 +- 0.0,0.8916 +- 0.0214,0.9298 +- 0.006,0.7656 +- 0.0074,0.7983 +- 0.0047,28986.0 +- 0.0,0.9009 +- 0.0068,0.8916 +- 0.0214,0.8754 +- 0.0324,28986.0 +- 0.0,0.8855 +- 0.0132,28986.0 +- 0.0,0.0 +- 0.0,0.8875 +- 0.0158,0.8524 +- 0.0039,0.7549 +- 0.0885,0.6551 +- 0.1112

presentations/presentation5.md

### Random Forest

Random dropout accuracy score 0.8776
Total samples: 9281
Number of inconsistent predictions: 0
Feature importance dropout (0.1% features dropped) accuracy score 0.8429
Feature importance dropout (0.5% features dropped) accuracy score 0.8200
Feature importance dropout (1.0% features dropped) accuracy score 0.7916
Feature importance dropout (2.0% features dropped) accuracy score 0.7102
--- Out of data distribution ---
Genes expected in training set: 10000
Genes actually matched in test set: 8693
Training data Max-Value: 8.634057
Test data Max-Value: 8.726716041564941
Baseline accuracy score 0.9065

### LogisticRegression

Random dropout accuracy score 0.9041
Total samples: 9281
Number of inconsistent predictions: 0
Feature importance dropout (0.1% features dropped) accuracy score 0.9192
Feature importance dropout (0.5% features dropped) accuracy score 0.8443
Feature importance dropout (1.0% features dropped) accuracy score 0.7861
Feature importance dropout (2.0% features dropped) accuracy score 0.7327
--- Out of data distribution ---
Genes expected in training set: 10000
Genes actually matched in test set: 8693
Training data Max-Value: 8.634057
Test data Max-Value: 8.726716041564941
Baseline accuracy score 0.8763